{
  "schema_version": "mark.model_config.v1",
  "id": "qwen3.5-122b-a10b",
  "provider": "nvidia",
  "transport": "openai_chat_completions",
  "endpoint": "https://integrate.api.nvidia.com/v1/chat/completions",
  "model": "qwen/qwen3.5-122b-a10b",
  "modalities": { "input": ["text", "image"], "output": ["text"] },
  "catalog_evidence": ["reasoning", "coding", "multimodal chat", "agent-ready", "tool calling"],
  "mark_roles": ["vacancy classification", "candidate fit scoring", "gap explanation", "JSON-prompted output"],
  "request_defaults": { "temperature": 0.1, "top_p": 1, "max_tokens": 700, "stream": false, "timeout_ms": 120000 },
  "benchmark": { "timeout_ms": 60000, "enabled": true },
  "status": "candidate",
  "notes": [
    "Quality-oriented candidate with 10B active parameters.",
    "Live benchmark 2026-07-16 was unstable: 2/3 HTTP success, 1/3 strict contract, one 60s timeout."
  ]
}
