{
  "schema_version": "mark.model_config.v1",
  "id": "deepseek-v4-flash",
  "provider": "nvidia",
  "transport": "openai_chat_completions",
  "endpoint": "https://integrate.api.nvidia.com/v1/chat/completions",
  "model": "deepseek-ai/deepseek-v4-flash",
  "modalities": { "input": ["text"], "output": ["text"] },
  "catalog_evidence": ["reasoning", "coding", "agents", "1M context", "MoE"],
  "mark_roles": ["vacancy classification", "candidate fit scoring", "ambiguous requirement reasoning"],
  "request_defaults": { "temperature": 0.1, "top_p": 1, "max_tokens": 700, "stream": false, "timeout_ms": 120000 },
  "benchmark": { "timeout_ms": 60000, "enabled": true },
  "status": "fallback",
  "notes": [
    "Reasoning-oriented fallback.",
    "Live benchmark 2026-07-16: 3/3 HTTP success, 3/3 strict contract, median 3231 ms, p95 9283 ms."
  ]
}
